{
  "candidate_archive_sha256": "aaaaaaaaaaaaaaaaaaaaaaaaaaaaaaaaaaaaaaaaaaaaaaaaaaaaaaaaaaaaaaaa",
  "challenge_sha256": "bbbbbbbbbbbbbbbbbbbbbbbbbbbbbbbbbbbbbbbbbbbbbbbbbbbbbbbbbbbbbbbb",
  "external_signer_identity_sha256": "8e9010e48347a0c2248531da2fbabb8ce8abedfc4a5dcd217eb011670209ebdf",
  "format_version": "1.1",
  "host_id": "host-v10-1-test-0001",
  "issued_at": "2026-08-07T00:22:30.519608+00:00",
  "not_after": "2026-08-15T00:32:30.519608+00:00",
  "not_before": "2026-08-06T00:32:30.519608+00:00",
  "probe_attestor_id": "probe-attestor-v10-1-0001",
  "probe_attestor_keyring_sha256": "f41c341b58b603e4f1e7cd7b156c9332c16b3fd59b1da0297268aa4667b6e3c4",
  "probe_attestor_revocation_state_sha256": "a25f1b252dbdfe3c7d14ad09213aabc867845ced5e05a2a55f5feced53085553",
  "probe_keyring_sha256": "e9256a0e9acadf3ff62caaa881fa37dcacff5ce5dfeadbad03f6fa53c1865140",
  "probe_policy_sha256": "f1ff2eaad2db77e472e68bb52de8a69deb5c7fbea5ca91da1182c8b6fdbc8f34",
  "probe_revocation_state_sha256": "d0c52105c18cb86c6dc64c3d95ace32406a39573ab08e42ab5155687ecbaa132",
  "probe_service_attestation_sha256": "d463ca7723f983ebe578bb8a76a11db5d491b74f15e08bbe4f07a49e9f6204a9",
  "probe_service_executable_sha256": "306c6ca7407560340797866e077e053627ad409277d1b9da58106fce4cf717cb",
  "probe_service_id": "probe-service-v10-1-0001",
  "probe_service_identity_sha256": "4b00f2125d58f084b2f99040caceb7560ab330b3f9f47a6e149195518c326a5f",
  "qualification_receipt_signing_public_key_sha256": "d4d4be27fd43e554d070dadc8f3264aff6533f268970c47f896fa1b2c1caefc8",
  "sequence": 9,
  "signature": "VyvOSRlwS7UNUC31QdvxeYxM6HBK7ld1uzHLR5ig057HP3WdD+tJugovnG9sZpqDC40ZLagEMvRJSE1zu2V9Cg==",
  "signer_key_id": "qualification-trust-authority-v10-1",
  "trust_manifest_id": "qualification-trust-v10-1-0001",
  "trust_manifest_kind": "AZPR_V10_1_QUALIFICATION_TRUST_ROOTS"
}
