{
  "candidate_archive_sha256": "aaaaaaaaaaaaaaaaaaaaaaaaaaaaaaaaaaaaaaaaaaaaaaaaaaaaaaaaaaaaaaaa",
  "challenge_sha256": "bbbbbbbbbbbbbbbbbbbbbbbbbbbbbbbbbbbbbbbbbbbbbbbbbbbbbbbbbbbbbbbb",
  "external_signer_identity_sha256": "d66f52b1b854b75319156dffd3c3156d34401f0cbb33b5f37a5bebc499300a89",
  "format_version": "1.1",
  "host_id": "host-v10-1-test-0001",
  "issued_at": "2026-08-07T00:43:28.434121+00:00",
  "not_after": "2026-08-15T00:53:28.434121+00:00",
  "not_before": "2026-08-06T00:53:28.434121+00:00",
  "probe_attestor_id": "probe-attestor-v10-1-0001",
  "probe_attestor_keyring_sha256": "9020b8c24f44840d70cb80af8a301cc2b8af3aea3080f35a4f87b18c9c848b75",
  "probe_attestor_revocation_state_sha256": "70834d3e24c66bcc8b931cc2f799ad8adb5c80ff022b7e249f00ca9fa26cf060",
  "probe_keyring_sha256": "b9f4047eb25fd6826a0019f519aca2f7b63d1259e1085d04d85229a48de25891",
  "probe_policy_sha256": "f1ff2eaad2db77e472e68bb52de8a69deb5c7fbea5ca91da1182c8b6fdbc8f34",
  "probe_revocation_state_sha256": "4d00de0b6bfe9a27874f90aa316f4e636dd3dd07745ae27931c483cc1de01672",
  "probe_service_attestation_sha256": "671d02edb1fd8c1e10ff1e4479c666cd95edd7dd11fe6ed831e130dcfc09a849",
  "probe_service_executable_sha256": "306c6ca7407560340797866e077e053627ad409277d1b9da58106fce4cf717cb",
  "probe_service_id": "probe-service-v10-1-0001",
  "probe_service_identity_sha256": "4b00f2125d58f084b2f99040caceb7560ab330b3f9f47a6e149195518c326a5f",
  "qualification_receipt_signing_public_key_sha256": "23ab0c2102e4217b0ba4e70c97552eebf9ae79ec3a2b7048932e53f1f9fe924e",
  "sequence": 9,
  "signature": "wV3wG5ar/t1M0ojbmtJsLfJzKonc/LTMcEiJPJaH+ywFfuCNwXyRGQZmBZgHR9QrZnddyx6ptupt3x7PiYfQDQ==",
  "signer_key_id": "qualification-trust-authority-v10-1",
  "trust_manifest_id": "qualification-trust-v10-1-0001",
  "trust_manifest_kind": "AZPR_V10_1_QUALIFICATION_TRUST_ROOTS"
}
