{
  "candidate_archive_sha256": "aaaaaaaaaaaaaaaaaaaaaaaaaaaaaaaaaaaaaaaaaaaaaaaaaaaaaaaaaaaaaaaa",
  "challenge_sha256": "bbbbbbbbbbbbbbbbbbbbbbbbbbbbbbbbbbbbbbbbbbbbbbbbbbbbbbbbbbbbbbbb",
  "external_signer_identity_sha256": "41f4ef1fd968eef632849727fe86abb6fd4844f7dffccb2650270163e4acf8fd",
  "format_version": "1.1",
  "host_id": "host-v10-1-test-0001",
  "issued_at": "2026-08-07T00:22:31.744617+00:00",
  "not_after": "2026-08-15T00:32:31.744617+00:00",
  "not_before": "2026-08-06T00:32:31.744617+00:00",
  "probe_attestor_id": "probe-attestor-v10-1-0001",
  "probe_attestor_keyring_sha256": "c1142fcc0ef66c167396ac86cb56f99f39e8fd6ec91c4fc0c27e0892a432e614",
  "probe_attestor_revocation_state_sha256": "38d1d841b93f53fcd0a187ea238c8d4259124d6248fb9a7976ee578abe59194b",
  "probe_keyring_sha256": "d7e910488c32e2ee914284c2a2adeb468af18ef08af04f45af1d71ac07306ae4",
  "probe_policy_sha256": "f1ff2eaad2db77e472e68bb52de8a69deb5c7fbea5ca91da1182c8b6fdbc8f34",
  "probe_revocation_state_sha256": "d0aa037ea1ab4dae93e9cc1fd499079c15e8c1f047eea0353b7de78a9ef8480b",
  "probe_service_attestation_sha256": "f52faeb2499a54bd4ab1e84feb558cbb6a608207d919a755362467f6ad20ce36",
  "probe_service_executable_sha256": "306c6ca7407560340797866e077e053627ad409277d1b9da58106fce4cf717cb",
  "probe_service_id": "probe-service-v10-1-0001",
  "probe_service_identity_sha256": "284e2a7e3c481d0d85233a201fe727c842a73ef906c0ef4705276dd09e32157c",
  "qualification_receipt_signing_public_key_sha256": "a23b1475c04366dc5a938314689d523e3758ce5035efa308c12b0a7f2919e369",
  "sequence": 9,
  "signature": "MUjmtF0pxJmSnhY1h8hqS75i1GAvrwDvs7Pl4SxRZYkB9dUCyPGJCSPDLOHXPMKWHbnyTMQwaprwE+R5Hgm4AA==",
  "signer_key_id": "qualification-trust-authority-v10-1",
  "trust_manifest_id": "qualification-trust-v10-1-0001",
  "trust_manifest_kind": "AZPR_V10_1_QUALIFICATION_TRUST_ROOTS"
}
