{
  "candidate_archive_sha256": "aaaaaaaaaaaaaaaaaaaaaaaaaaaaaaaaaaaaaaaaaaaaaaaaaaaaaaaaaaaaaaaa",
  "challenge_sha256": "bbbbbbbbbbbbbbbbbbbbbbbbbbbbbbbbbbbbbbbbbbbbbbbbbbbbbbbbbbbbbbbb",
  "external_signer_identity_sha256": "a1b8850aec8ca6da022699fad77ade599e3664f14dfc1e2983f984fedf3701ae",
  "format_version": "1.1",
  "host_id": "host-v10-1-test-0001",
  "issued_at": "2026-08-07T00:43:31.409911+00:00",
  "not_after": "2026-08-15T00:53:31.409911+00:00",
  "not_before": "2026-08-06T00:53:31.409911+00:00",
  "probe_attestor_id": "probe-attestor-v10-1-0001",
  "probe_attestor_keyring_sha256": "b5a1c227e1f9d3f2efda87817fee5f8852ead3fecfa69d4aa1d84a55457bfe9f",
  "probe_attestor_revocation_state_sha256": "4aa9b2f5eba94c567da897704d4b88db6d82b63579dadb7e26f4a00447037fc4",
  "probe_keyring_sha256": "0a2a49d1d3508cf0f5ce763fe97ef91a0817a48598866ff851508c0d49efa51c",
  "probe_policy_sha256": "f1ff2eaad2db77e472e68bb52de8a69deb5c7fbea5ca91da1182c8b6fdbc8f34",
  "probe_revocation_state_sha256": "dc7d20f2c2374d2559b42a27818fdd9c531be507ee4a9596eaec9a2fb28ff177",
  "probe_service_attestation_sha256": "066273d686b577a85a121517343ed2563823b287cb1e2a635d4a43a19268aefa",
  "probe_service_executable_sha256": "306c6ca7407560340797866e077e053627ad409277d1b9da58106fce4cf717cb",
  "probe_service_id": "probe-service-v10-1-0001",
  "probe_service_identity_sha256": "4b00f2125d58f084b2f99040caceb7560ab330b3f9f47a6e149195518c326a5f",
  "qualification_receipt_signing_public_key_sha256": "fd07738adf6c98a9951f3216a191384acf806a49384c79508cb5e0e708e9beca",
  "sequence": 9,
  "signature": "xSO3/VCsS1pvFXMGncjxNDHn8NfrlkKbdbzwj0siiZxvW3vbfqZTr8ACY/MWsv9IFoTooY36LgkGmODt/EfJAw==",
  "signer_key_id": "qualification-trust-authority-v10-1",
  "trust_manifest_id": "qualification-trust-v10-1-0001",
  "trust_manifest_kind": "AZPR_V10_1_QUALIFICATION_TRUST_ROOTS"
}
