{
  "candidate_archive_sha256": "aaaaaaaaaaaaaaaaaaaaaaaaaaaaaaaaaaaaaaaaaaaaaaaaaaaaaaaaaaaaaaaa",
  "challenge_sha256": "bbbbbbbbbbbbbbbbbbbbbbbbbbbbbbbbbbbbbbbbbbbbbbbbbbbbbbbbbbbbbbbb",
  "external_signer_identity_sha256": "cd65bfdb9a3c2c55d25d54f805a49f1247c565443dee2812d43c02f98421a82e",
  "format_version": "1.1",
  "host_id": "host-v10-1-test-0001",
  "issued_at": "2026-08-07T00:43:29.608961+00:00",
  "not_after": "2026-08-15T00:53:29.608961+00:00",
  "not_before": "2026-08-06T00:53:29.608961+00:00",
  "probe_attestor_id": "probe-attestor-v10-1-0001",
  "probe_attestor_keyring_sha256": "c203b90b7fd1386534aba2a077ecb9f21f2bee1d6136b7a8cb891d7e1ff8e2a8",
  "probe_attestor_revocation_state_sha256": "aad2b099e7955dba67c0654e78d01a7ee74e073be726d2b6c52112a14e16e9eb",
  "probe_keyring_sha256": "aed4b9761b7ee7e6c1244daae32f0ae86ab9b1a1b3336ca26986d44c9caae05b",
  "probe_policy_sha256": "f1ff2eaad2db77e472e68bb52de8a69deb5c7fbea5ca91da1182c8b6fdbc8f34",
  "probe_revocation_state_sha256": "be180736bad3cb32bb56da0703214e09b77628d478fb68b0cabc3b1c52f62262",
  "probe_service_attestation_sha256": "c4490f7a673e9b32fc3dcae59ceee081cd83439343a0034fa26390ad2d0ffed0",
  "probe_service_executable_sha256": "306c6ca7407560340797866e077e053627ad409277d1b9da58106fce4cf717cb",
  "probe_service_id": "probe-service-v10-1-0001",
  "probe_service_identity_sha256": "4b00f2125d58f084b2f99040caceb7560ab330b3f9f47a6e149195518c326a5f",
  "qualification_receipt_signing_public_key_sha256": "3b6ef541de45e8a4b1799ecf32254d0d78e0ca550b68cdfaf5c2be9af53c3bb1",
  "sequence": 9,
  "signature": "BDqt9y5ABEIChSRqcqWsS872D1o/ZF9hdW03dMidNJqtubcBXpTptOMtG9MJjzRIRRNqUCtthVzuhRTJQ3gyCA==",
  "signer_key_id": "qualification-trust-authority-v10-1",
  "trust_manifest_id": "qualification-trust-v10-1-0001",
  "trust_manifest_kind": "AZPR_V10_1_QUALIFICATION_TRUST_ROOTS"
}
