{
  "candidate_archive_sha256": "aaaaaaaaaaaaaaaaaaaaaaaaaaaaaaaaaaaaaaaaaaaaaaaaaaaaaaaaaaaaaaaa",
  "challenge_sha256": "bbbbbbbbbbbbbbbbbbbbbbbbbbbbbbbbbbbbbbbbbbbbbbbbbbbbbbbbbbbbbbbb",
  "external_signer_identity_sha256": "7886a4981bf082df4d51a7001fbd5c5a605a267e2a593035d85835d3105fad81",
  "format_version": "1.1",
  "host_id": "host-v10-1-test-0001",
  "issued_at": "2026-08-07T00:43:31.017006+00:00",
  "not_after": "2026-08-15T00:53:31.017006+00:00",
  "not_before": "2026-08-06T00:53:31.017006+00:00",
  "probe_attestor_id": "probe-attestor-v10-1-0001",
  "probe_attestor_keyring_sha256": "fb258a12d9c12b28f1bd6deb61cdf3c84e666fad31c91b1937fe388ae2da1b11",
  "probe_attestor_revocation_state_sha256": "ff2346165ff61a4d56eca42e9af98982857a416cd56e095a683d65ea95327841",
  "probe_keyring_sha256": "fba301879b9696e9b4fa17ef574f8b10675d10b113891d6da9ea962111599d1d",
  "probe_policy_sha256": "f1ff2eaad2db77e472e68bb52de8a69deb5c7fbea5ca91da1182c8b6fdbc8f34",
  "probe_revocation_state_sha256": "c6d6c102eea3e9dd58dc52e0568a083e690517f67eab119e50add2b4fbc57d11",
  "probe_service_attestation_sha256": "29983a862d3e4262cdfebbf42b950e509e7f09a784efec425c0ced32ad923928",
  "probe_service_executable_sha256": "306c6ca7407560340797866e077e053627ad409277d1b9da58106fce4cf717cb",
  "probe_service_id": "probe-service-v10-1-0001",
  "probe_service_identity_sha256": "4b00f2125d58f084b2f99040caceb7560ab330b3f9f47a6e149195518c326a5f",
  "qualification_receipt_signing_public_key_sha256": "99706f3cd23d9e7eecc4bf5170681af8cb2e4c4891400380d7610621e21879b7",
  "sequence": 9,
  "signature": "w/Q9G+Y6UboU98NhgejCSem4epSVGA6HV1A9aGk6WjHUbYRIGueF4Umq9rIZ2O8MhHsmhY6C2uM6LAp2jmUvCQ==",
  "signer_key_id": "qualification-trust-authority-v10-1",
  "trust_manifest_id": "qualification-trust-v10-1-0001",
  "trust_manifest_kind": "AZPR_V10_1_QUALIFICATION_TRUST_ROOTS"
}
