{
  "candidate_archive_sha256": "aaaaaaaaaaaaaaaaaaaaaaaaaaaaaaaaaaaaaaaaaaaaaaaaaaaaaaaaaaaaaaaa",
  "challenge_sha256": "bbbbbbbbbbbbbbbbbbbbbbbbbbbbbbbbbbbbbbbbbbbbbbbbbbbbbbbbbbbbbbbb",
  "external_signer_identity_sha256": "fdcac1b3846ceee68494a8fe69e7732d7354194528d1aa6f5e2d4d96c79c9475",
  "format_version": "1.1",
  "host_id": "host-v10-1-test-0001",
  "issued_at": "2026-08-07T00:22:31.330261+00:00",
  "not_after": "2026-08-15T00:32:31.330261+00:00",
  "not_before": "2026-08-06T00:32:31.330261+00:00",
  "probe_attestor_id": "probe-attestor-v10-1-0001",
  "probe_attestor_keyring_sha256": "486f404d8a5925f54924e1fafc108c140de179bc07b2db2a94622e607547ab65",
  "probe_attestor_revocation_state_sha256": "54b3b680d4c529aab4ef9be6d6397a6db842f806bd3137cade2533eb74ba9a91",
  "probe_keyring_sha256": "f940fe5ea79500a9ff0405d26968420f8ae092187094138ec0deda7cb9c81953",
  "probe_policy_sha256": "f1ff2eaad2db77e472e68bb52de8a69deb5c7fbea5ca91da1182c8b6fdbc8f34",
  "probe_revocation_state_sha256": "3dde5bf3c53196ba66d9d3c79e7d2194ca2030a981ff007d8371b501a94bc912",
  "probe_service_attestation_sha256": "7e167589772e9a60e270a40ed26fe198a365f0a1e34ecd53ea32a13a979f6b61",
  "probe_service_executable_sha256": "306c6ca7407560340797866e077e053627ad409277d1b9da58106fce4cf717cb",
  "probe_service_id": "probe-service-v10-1-0001",
  "probe_service_identity_sha256": "4b00f2125d58f084b2f99040caceb7560ab330b3f9f47a6e149195518c326a5f",
  "qualification_receipt_signing_public_key_sha256": "1684bbb63c2735cd39bdb6e59cff42676847f9f9a5d098ae43d79ab05493be94",
  "sequence": 9,
  "signature": "We1eaUWpoiT7f3AIhUMSDJp/wxpFhLfHDizuSf1IY2EHPo2cuaB+1syO3xlBJI26An+m9euKBGb4t32ZLSHKCQ==",
  "signer_key_id": "qualification-trust-authority-v10-1",
  "trust_manifest_id": "qualification-trust-v10-1-0001",
  "trust_manifest_kind": "AZPR_V10_1_QUALIFICATION_TRUST_ROOTS"
}
