{
  "candidate_archive_sha256": "aaaaaaaaaaaaaaaaaaaaaaaaaaaaaaaaaaaaaaaaaaaaaaaaaaaaaaaaaaaaaaaa",
  "challenge_sha256": "bbbbbbbbbbbbbbbbbbbbbbbbbbbbbbbbbbbbbbbbbbbbbbbbbbbbbbbbbbbbbbbb",
  "external_signer_identity_sha256": "564ac03c0e7da47e4ba614d83e8dd4c0486463b3809497468892a22abc2c4b8c",
  "format_version": "1.1",
  "host_id": "host-v10-1-test-0001",
  "issued_at": "2026-08-07T00:22:30.917898+00:00",
  "not_after": "2026-08-15T00:32:30.917898+00:00",
  "not_before": "2026-08-06T00:32:30.917898+00:00",
  "probe_attestor_id": "probe-attestor-v10-1-0001",
  "probe_attestor_keyring_sha256": "6a031d1d7e64e2bfe7cd0715e632c8033f90623107fa4b4e0d42a980326f09fb",
  "probe_attestor_revocation_state_sha256": "36bbbcf2e7679d0f449df75519ce0be85f918662889e37b034b542e340509907",
  "probe_keyring_sha256": "f79ef3a7fa4e2ed2ecf007a415504a7474e27f184e9c5fc7b0c23fea486d6cad",
  "probe_policy_sha256": "6237de74c498c2008e70f94719e7887c41f767e0ed51bcc1d7344e16ce4976dc",
  "probe_revocation_state_sha256": "44023e56165340ea55d137dce582ec763b7b01e4bc762d0e0d5c19c8f021c8c2",
  "probe_service_attestation_sha256": "f791efb57a7dfc46a99859f0e3cce3b79578cba88bc4fc6a5555673433a2ad86",
  "probe_service_executable_sha256": "306c6ca7407560340797866e077e053627ad409277d1b9da58106fce4cf717cb",
  "probe_service_id": "probe-service-v10-1-0001",
  "probe_service_identity_sha256": "4b00f2125d58f084b2f99040caceb7560ab330b3f9f47a6e149195518c326a5f",
  "qualification_receipt_signing_public_key_sha256": "f49208f3d47fd091f232cb401326ef367642f7fcdf0cd78064a7f22b37e8091d",
  "sequence": 9,
  "signature": "/QiFNfnvub/r5/R8TbUPnpp0+TX/+dZ1uYaJJjV7yJZ8000trxVQ5jylwFliHeWpRWZ4jLQGaR6OcCSgQ5qfDg==",
  "signer_key_id": "qualification-trust-authority-v10-1",
  "trust_manifest_id": "qualification-trust-v10-1-0001",
  "trust_manifest_kind": "AZPR_V10_1_QUALIFICATION_TRUST_ROOTS"
}
