{
  "candidate_archive_sha256": "aaaaaaaaaaaaaaaaaaaaaaaaaaaaaaaaaaaaaaaaaaaaaaaaaaaaaaaaaaaaaaaa",
  "challenge_sha256": "bbbbbbbbbbbbbbbbbbbbbbbbbbbbbbbbbbbbbbbbbbbbbbbbbbbbbbbbbbbbbbbb",
  "external_signer_identity_sha256": "501127eaa8152124afabb9ab0f32e465df3ad9eb9d208b3b541fd63ea01909c9",
  "format_version": "1.1",
  "host_id": "host-v10-1-test-0001",
  "issued_at": "2026-08-07T00:43:29.996079+00:00",
  "not_after": "2026-08-15T00:53:29.996079+00:00",
  "not_before": "2026-08-06T00:53:29.996079+00:00",
  "probe_attestor_id": "probe-attestor-v10-1-0001",
  "probe_attestor_keyring_sha256": "41f8489aad6f86ca719fd3dc238021211309e7fa27af14bde35074e22354dae5",
  "probe_attestor_revocation_state_sha256": "1b0b1dcf3b1aee1db9ed6f9a4c2805bcbfb993e2ca6017276a2945cc961a4cc8",
  "probe_keyring_sha256": "10b7d22a9f7e1f7a56bc1da7cd33020290193c710b262241307f160b3153ddcc",
  "probe_policy_sha256": "f1ff2eaad2db77e472e68bb52de8a69deb5c7fbea5ca91da1182c8b6fdbc8f34",
  "probe_revocation_state_sha256": "69102ae9021df70411bc8a942011b6f55e40256d9f634d51c6db65260493ffe6",
  "probe_service_attestation_sha256": "211d3c188b68c0ed5ded319e606a75d8130fede132215438447431035c6ffff8",
  "probe_service_executable_sha256": "306c6ca7407560340797866e077e053627ad409277d1b9da58106fce4cf717cb",
  "probe_service_id": "probe-service-v10-1-0001",
  "probe_service_identity_sha256": "284e2a7e3c481d0d85233a201fe727c842a73ef906c0ef4705276dd09e32157c",
  "qualification_receipt_signing_public_key_sha256": "770527e17fcbe4ffc32eb8ef26b2a2c985b236159e993e5f0c4d15ac0e0c3ed5",
  "sequence": 9,
  "signature": "dV6St28pnE+XZJPqKUFioRqrPWeSLOsEOFUCnGmPoGJw8BjT2DqEkuPjm/fV3SWVCmVtv13glPJawkDGBrY6BA==",
  "signer_key_id": "qualification-trust-authority-v10-1",
  "trust_manifest_id": "qualification-trust-v10-1-0001",
  "trust_manifest_kind": "AZPR_V10_1_QUALIFICATION_TRUST_ROOTS"
}
