{
  "candidate_archive_sha256": "aaaaaaaaaaaaaaaaaaaaaaaaaaaaaaaaaaaaaaaaaaaaaaaaaaaaaaaaaaaaaaaa",
  "challenge_sha256": "bbbbbbbbbbbbbbbbbbbbbbbbbbbbbbbbbbbbbbbbbbbbbbbbbbbbbbbbbbbbbbbb",
  "external_signer_identity_sha256": "e87d833c9407ffa2249fbdbd1f62238d05617344c8964fcc210dbb4078e3dcc4",
  "format_version": "1.1",
  "host_id": "host-v10-1-test-0001",
  "issued_at": "2026-08-07T00:43:33.058285+00:00",
  "not_after": "2026-08-15T00:53:33.058285+00:00",
  "not_before": "2026-08-06T00:53:33.058285+00:00",
  "probe_attestor_id": "probe-attestor-v10-1-0001",
  "probe_attestor_keyring_sha256": "123e12914f0f45c2b669e9bddff2d4d40a204179574dfe37983956d3cba01043",
  "probe_attestor_revocation_state_sha256": "b0aa89a52470ccf4f2393edccdea568852045999db814e30b2ea980e0b948378",
  "probe_keyring_sha256": "3c5084a3b04cb688c7f4a7d140b17f290a710f73cf4afe3831c44e50e6b127e3",
  "probe_policy_sha256": "f1ff2eaad2db77e472e68bb52de8a69deb5c7fbea5ca91da1182c8b6fdbc8f34",
  "probe_revocation_state_sha256": "3bd1a53efcd36b12fff08cc0e313322c42a14278c373044f513c3be95ede0b5e",
  "probe_service_attestation_sha256": "bb4ce90ccc19b8884f5dcb365ef229cd4d21675ca98e42a53ed04a1f2c9a6bc5",
  "probe_service_executable_sha256": "306c6ca7407560340797866e077e053627ad409277d1b9da58106fce4cf717cb",
  "probe_service_id": "probe-service-v10-1-0001",
  "probe_service_identity_sha256": "4b00f2125d58f084b2f99040caceb7560ab330b3f9f47a6e149195518c326a5f",
  "qualification_receipt_signing_public_key_sha256": "ea37fdf17c74952150006c289c602874a7a774a7aa74904616c4ef9f11d14462",
  "sequence": 9,
  "signature": "Dg7QwCszA5kg0RQkQ8+0LArOchLprzZRjVfHhHJtqRMdqXdlp74mN3AtsOZo0XcAgxmFZvOyQlaNthMfHG6IDA==",
  "signer_key_id": "qualification-trust-authority-v10-1",
  "trust_manifest_id": "qualification-trust-v10-1-0001",
  "trust_manifest_kind": "AZPR_V10_1_QUALIFICATION_TRUST_ROOTS"
}
